<?xml version="1.0" encoding="UTF-8"?>
<?xml-stylesheet type="text/css" href="style.css"?>

<!--5. Расписание занятий. Расписание занятий у каждой группы свое. Для-->
<!--каждого дня недели расписание свое. При этом некоторые дни недели могут-->
<!--быть свободны. Кроме этого расписание на четной и нечетной неделе может-->
<!--отличаться. В расписании указывается название предмета, тип (лекция,-->
<!--практика, лабораторные работы), аудитория (корпус и номер), в которой-->
<!--будет проходить занятие, ссылка на информацию о преподавателе, которая-->
<!--хранится в отдельном файле. В информацию о преподавателе входит ФИО,-->
<!--должность, кафедра, университет, контактная информация (телефон рабочий,-->
<!--домашний, E-mail). Необходимо учесть, что рабочий телефон может быть не-->
<!--один, домашнего телефона может не быть или быть несколько, e-mail может-->
<!--не быть или быть несколько.-->

<xs:schema xmlns:xs="http://www.w3.org/2001/XMLSchema">
    <xs:element name="timetable_catalog">
        <xs:complexType>
            <xs:sequence>
                <xs:element name="timetable">
                    <xs:complexType>
                        <xs:sequence>
                            <xs:element name="group" type="xs:string"/>
                            <xs:element name="week_day">
                                <xs:complexType>
                                    <xs:sequence>
                                        <xs:element name="week_day_name" type="xs:string"/>
                                        <xs:element name="subjects">
                                            <xs:complexType>
                                                <xs:sequence>
                                                    <xs:element name="title" type="xs:string"/>
                                                    <xs:element name="type_of_lesson">
                                                        <xs:simpleType>
                                                            <xs:restriction base="xs:string">
                                                                <xs:enumeration value="lecture"/>
                                                                <xs:enumeration value="practice"/>
                                                                <xs:enumeration value="laboratory work"/>
                                                            </xs:restriction>
                                                        </xs:simpleType>
                                                    </xs:element>
                                                    <xs:element name="classroom_number" type="xs:positiveInteger"/>
                                                    <xs:element name="teacher" type="xs:string"/>
                                                </xs:sequence>
                                            </xs:complexType>
                                        </xs:element>
                                    </xs:sequence>
                                </xs:complexType>
                            </xs:element>
                            <xs:element name="parity">
                            </xs:element>
                        </xs:sequence>
                    </xs:complexType>
                </xs:element>
            </xs:sequence>
        </xs:complexType>
    </xs:element>
</xs:schema>
